{
  "correction_id": "measurement-conflict-gladyform-vb10-pom9-l-v1",
  "record_version": 1,
  "category": "measurement",
  "style_id": "gladyform__vb10",
  "style_version": "vB 1.0",
  "concept_id": "cup_height",
  "pom_number": 9,
  "before": {
    "size_code": "L",
    "unit": "in",
    "observations": [
      {"value_in": 8.875, "source_row": 1053, "raw_term": "Outer Cup height"},
      {"value_in": 7.75, "source_row": 1059, "raw_term": "Inner Cup height"}
    ]
  },
  "after": {"size_code": "L", "value_in": 8.875, "unit": "in", "selected_source_row": 1053},
  "reason": "TD confirmed the 8.875 inch Outer Cup height observation as the correct Size-L POM 9 value; preserve 7.75 inch Inner Cup height for audit.",
  "source_versions": {"candidate_schema": "pending-intake-candidate.v1", "correction_schema": "1.0.0"},
  "source_fingerprints": ["sha256:363358a282e712a5e53ae4e26e6009a1c16a67cebcda398f911bfaa93df1e8e0"],
  "td_status": "accepted",
  "status": "reviewed",
  "created_at": "2026-07-12T00:00:00+07:00",
  "reviewed_at": "2026-07-12T00:00:00+07:00",
  "reviewed_by": "TD",
  "promoted_record_id": null
}
