{
  "correction_id": "measurement-conflict-lacygrace-va30-pom10-l-v1",
  "record_version": 1,
  "category": "measurement",
  "style_id": "lacygrace__va30",
  "style_version": "vA 3.0",
  "concept_id": "cup_width",
  "pom_number": 10,
  "before": {
    "size_code": "L",
    "unit": "in",
    "observations": [
      {"value_in": 8.625, "source_row": 1405, "raw_term": "Outer Cup width"},
      {"value_in": 8.125, "source_row": 1415, "raw_term": "Inner Cup Width"}
    ]
  },
  "after": {"size_code": "L", "value_in": 8.625, "unit": "in", "selected_source_row": 1405},
  "reason": "TD confirmed the 8.625 inch Outer Cup width observation as the correct Size-L POM 10 value; preserve 8.125 inch Inner Cup Width for audit.",
  "source_versions": {"candidate_schema": "pending-intake-candidate.v1", "correction_schema": "1.0.0"},
  "source_fingerprints": ["sha256:363358a282e712a5e53ae4e26e6009a1c16a67cebcda398f911bfaa93df1e8e0"],
  "td_status": "accepted",
  "status": "reviewed",
  "created_at": "2026-07-12T00:00:00+07:00",
  "reviewed_at": "2026-07-12T00:00:00+07:00",
  "reviewed_by": "TD",
  "promoted_record_id": null
}
