{
  "correction_id": "measurement-conflict-laralift-va20-pom8-l-v1",
  "record_version": 1,
  "category": "measurement",
  "style_id": "laralift__va20",
  "style_version": "vA 2.0",
  "concept_id": "cup_height_center_front",
  "pom_number": 8,
  "before": {
    "size_code": "L",
    "unit": "in",
    "observations": [
      {
        "value_in": 2.5,
        "source_row": 1435,
        "raw_term": "Cup Height at Center Front"
      },
      {
        "value_in": 1,
        "source_row": 1436,
        "raw_term": "Cup Height at Center Front"
      }
    ]
  },
  "after": {
    "size_code": "L",
    "value_in": 2.5,
    "unit": "in",
    "selected_source_row": 1435
  },
  "reason": "TD confirmed 2.5 inch as the correct Size-L POM 8 value; preserve the conflicting 1 inch observation for audit.",
  "source_versions": {
    "candidate_schema": "pending-intake-candidate.v1",
    "correction_schema": "1.0.0"
  },
  "source_fingerprints": [
    "sha256:363358a282e712a5e53ae4e26e6009a1c16a67cebcda398f911bfaa93df1e8e0"
  ],
  "td_status": "accepted",
  "status": "reviewed",
  "created_at": "2026-07-12T00:00:00+07:00",
  "reviewed_at": "2026-07-12T00:00:00+07:00",
  "reviewed_by": "TD",
  "promoted_record_id": null
}
